{
  "metadata": {
    "blueprintId": "python-multi-agent",
    "blueprintName": "Python Multi-Agent System Blueprint",
    "description": "Multi-agent AI systems with CrewAI, AutoGen, and LangGraph",
    "version": "1.0.0",
    "author": "Antigravity Agent Factory",
    "tags": [
      "python",
      "multi-agent",
      "crewai",
      "autogen",
      "langgraph",
      "ai"
    ],
    "purpose": "Enable development of sophisticated multi-agent systems for complex task automation"
  },
  "stack": {
    "primaryLanguage": "python",
    "frameworks": [
      {
        "name": "CrewAI",
        "version": "1.10+",
        "purpose": "Role-based agent orchestration"
      },
      {
        "name": "AutoGen",
        "version": "0.11+",
        "purpose": "Conversational multi-agent",
        "optional": true
      },
      {
        "name": "LangGraph",
        "version": "1.0+",
        "purpose": "State machine workflows"
      },
      {
        "name": "LangChain",
        "version": "1.2+",
        "purpose": "Agent tools and chains"
      },
      {
        "name": "FastAPI",
        "version": "0.135+",
        "purpose": "API serving"
      },
      {
        "name": "Pydantic",
        "version": "2.12+",
        "purpose": "Data validation"
      }
    ],
    "databases": [
      {
        "type": "vector",
        "name": "ChromaDB",
        "purpose": "Agent memory"
      },
      {
        "type": "sql",
        "name": "SQLite",
        "purpose": "Task history"
      },
      {
        "type": "cache",
        "name": "Redis",
        "purpose": "Session state",
        "optional": true
      }
    ],
    "llmProviders": [
      {
        "name": "OpenAI",
        "models": [
          "gpt-5.2",
          "gpt-5.3-codex",
          "gpt-4o",
          "gpt-4o-mini",
          "o1",
          "o1-mini"
        ],
        "purpose": "Primary LLM"
      },
      {
        "name": "Anthropic",
        "models": [
          "claude-opus-4.6",
          "claude-3-5-sonnet-20241022",
          "claude-3-5-haiku-20241022"
        ],
        "purpose": "Alternative LLM",
        "optional": true
      }
    ],
    "tools": [
      {
        "name": "pytest",
        "purpose": "Testing"
      },
      {
        "name": "ruff",
        "purpose": "Linting"
      },
      {
        "name": "langsmith",
        "purpose": "Tracing"
      },
      {
        "name": "crewai-tools",
        "purpose": "Agent tools"
      }
    ]
  },
  "agents": [
    {
      "patternId": "code-reviewer",
      "required": true
    },
    {
      "patternId": "test-generator",
      "required": true
    },
    {
      "patternId": "documentation-agent",
      "required": true
    },
    {
      "patternId": "knowledge-extender",
      "required": true,
      "description": "Extend knowledge base during development"
    },
    {
      "patternId": "knowledge-evolution",
      "required": true,
      "description": "Manage and evolve project knowledge independently"
    },
    {
      "patternId": "factory-updates",
      "required": true,
      "description": "Receive updates from the Antigravity Agent Factory"
    },
    {
      "patternId": "debug-conductor-project",
      "required": false,
      "description": "Autonomous debugging agent for CI/CD and test failures"
    }
  ],
  "skills": [
    {
      "patternId": "prompt-engineering",
      "required": true
    },
    {
      "patternId": "grounding-verification",
      "required": true,
      "default": true,
      "description": "Two-pass verification for LLM grounding and factual claims"
    },
    {
      "patternId": "alignment-check",
      "required": true,
      "default": true,
      "description": "Verify understanding before major implementations"
    },
    {
      "patternId": "research-first-project",
      "required": true,
      "default": true,
      "description": "Research existing solutions before building"
    },
    {
      "patternId": "bugfix-workflow",
      "required": true
    },
    {
      "patternId": "feature-workflow",
      "required": true
    },
    {
      "patternId": "extend-knowledge",
      "required": true,
      "description": "Extend knowledge base with new topics"
    },
    {
      "patternId": "receive-updates",
      "required": true,
      "description": "Receive updates from Factory"
    },
    {
      "patternId": "ci-monitor-project",
      "required": false,
      "default": true,
      "description": "Monitor CI/CD pipelines with automatic error detection"
    },
    {
      "patternId": "pipeline-error-fix-project",
      "required": false,
      "default": true,
      "description": "Systematic pipeline error detection and fixing"
    }
  ],
  "knowledge": [
    {
      "filename": "multi-agent-patterns.json",
      "description": "Multi-agent coordination patterns"
    },
    {
      "filename": "crewai-patterns.json",
      "description": "CrewAI-specific patterns"
    },
    {
      "filename": "autogen-patterns.json",
      "description": "AutoGen patterns"
    },
    {
      "filename": "langgraph-workflows.json",
      "description": "LangGraph state machines"
    },
    {
      "filename": "llm-provider-comparison.json",
      "description": "LLM selection guide"
    }
  ],
  "projectStructure": {
    "directories": [
      {
        "path": ".agent/agents/",
        "purpose": "AI agent definitions"
      },
      {
        "path": ".agent/skills/",
        "purpose": "Reusable skills"
      },
      {
        "path": "src/",
        "purpose": "Source code"
      },
      {
        "path": "src/agents/",
        "purpose": "Agent definitions"
      },
      {
        "path": "src/crews/",
        "purpose": "Crew configurations"
      },
      {
        "path": "src/tasks/",
        "purpose": "Task definitions"
      },
      {
        "path": "src/tools/",
        "purpose": "Custom tools"
      },
      {
        "path": "src/workflows/",
        "purpose": "LangGraph workflows"
      },
      {
        "path": "src/api/",
        "purpose": "API endpoints"
      },
      {
        "path": "config/",
        "purpose": "Configuration files"
      },
      {
        "path": "prompts/",
        "purpose": "Agent prompts"
      },
      {
        "path": "tests/",
        "purpose": "Test files"
      }
    ],
    "files": [
      {
        "path": ".agentrules",
        "purpose": "Agent behavior rules"
      },
      {
        "path": "README.md",
        "purpose": "Project documentation"
      },
      {
        "path": "pyproject.toml",
        "purpose": "Python project config"
      },
      {
        "path": "requirements.txt",
        "purpose": "Dependencies"
      },
      {
        "path": "main.py",
        "purpose": "Entry point"
      },
      {
        "path": ".env.example",
        "purpose": "Environment template"
      }
    ]
  },
  "cursorrules": {
    "variables": [
      {
        "name": "OPENAI_API_KEY",
        "description": "OpenAI API key"
      },
      {
        "name": "LANGCHAIN_TRACING_V2",
        "description": "Enable LangSmith",
        "default": "true"
      }
    ],
    "rules": [
      {
        "name": "Agent Roles",
        "description": "Define clear, non-overlapping agent roles"
      },
      {
        "name": "Task Dependencies",
        "description": "Specify task dependencies explicitly"
      },
      {
        "name": "Error Handling",
        "description": "Implement fallbacks for agent failures"
      },
      {
        "name": "Iteration Limits",
        "description": "Set max iterations to prevent loops"
      },
      {
        "name": "Tracing",
        "description": "Enable LangSmith for debugging"
      }
    ]
  },
  "pmIntegration": {
    "enabled": false,
    "description": "Optional project management integration with agile workflows",
    "agents": [
      {
        "patternId": "product-owner",
        "description": "Creates and refines stories, prioritizes backlog"
      },
      {
        "patternId": "sprint-master",
        "description": "Facilitates sprint ceremonies and removes blockers"
      },
      {
        "patternId": "task-manager",
        "description": "Breaks stories into tasks, manages issues"
      },
      {
        "patternId": "reporting-agent",
        "description": "Generates metrics, burndowns, dashboards"
      }
    ],
    "skills": [
      {
        "patternId": "create-story",
        "description": "Create user stories with acceptance criteria"
      },
      {
        "patternId": "create-epic",
        "description": "Create epics with child story structure"
      },
      {
        "patternId": "create-task",
        "description": "Create implementation tasks"
      },
      {
        "patternId": "plan-sprint",
        "description": "Sprint planning workflow"
      },
      {
        "patternId": "run-standup",
        "description": "Daily standup facilitation"
      },
      {
        "patternId": "close-sprint",
        "description": "Sprint closure and velocity calculation"
      }
    ],
    "backends": [
      "github",
      "jira",
      "linear",
      "azure-devops"
    ]
  },
  "workflows": [
    "factory-standard-workflow"
  ]
}
